{"id":"RETRO2","name":"research retrospective after E11-E13","hypothesis":"After 4 experiments (E11-E13 + first RETRO), re-examine patterns, Goodhart risks, and adversarial falsification to re-rank the experiment queue.","changes":[],"kept":"n/a (investigation)","commit":null,"hallucination_rate":"0.0% (unchanged; renamed to invented_symbol_rate)","high":"0","medium":"0","low":"0","grounded":"268 (unchanged)","coverage_pct":"70.7 (unchanged)","coverage_abs":"135/191 (unchanged)","judge_acc":null,"judge_comp":null,"judge_usab":null,"judge_clar":null,"judge_overall":"3.73 (unchanged)","judge_hallucinations":null,"notes":"3 parallel independent subagents: (1) patterns — deterministic changes win, add-more-context regresses, measure-instrument-fix works; (2) Goodhart — coverage is mention-frequency proxy, hallucination is symbol-existence only, broken-examples 6.2% is largely self-inflicted via E13's <REQUIRED> placeholders (19 across 9/11 e2e pages, 10/13 residual findings), grounded-claims is a repetition-count; (3) adversarial — 7 source-verified factual errors in prose/tables, ALL missed by current checkers (method-vs-property confusion, return-type mismatches, arg-type mismatches, cross-page inconsistency). Key decisions: E13b (fix placeholder) promoted to NEXT; E18 (prose API semantics checker) promoted to second; E14 re-scoped with 2x-band threshold (4.2pp coverage, 24 grounded) and post-surgical placeholder-aware broken% as co-primary metric; add placeholder_value finding type to example_check.py; rename hallucination_rate to invented_symbol_rate. Synthesis at /tmp/rq-trials/agents/RETRO2_synthesis.md."}
{"id": "E13b", "name": "fix REQUIRED placeholder with value inference", "hypothesis": "Replacing E13's <REQUIRED> placeholder with a valid inferred value (from sibling kwargs or AST default) or omitting the kwarg with an annotation will make the broken-examples metric honest and eliminate the metric-gaming artifact.", "changes": ["repoquill/surgical_verify.py: build_class_index now captures init_defaults (ast.unparse of default values); new _infer_value() function (Rule 1: AST default, Rule 2: judge_X mirrors X, Rule 3: provider mirrors judge_provider); _fix_missing_required_in_block uses _infer_value instead of inserting <REQUIRED>; _normalize_quotes for consistent double-quote style; trailing-comma detection to avoid double commas", "/tmp/rq-trials/harness/example_check.py: new placeholder_value finding type; _is_placeholder() checks for <REQUIRED>, TODO, FIXME, PLACEHOLDER, ..., <value>, <arg>, <name> sentinel values"], "kept": true, "commit": "5c08779", "hallucination_rate": "0.0%", "high": "0", "medium": "0", "low": "0", "grounded": "277 (mean of 3 runs: 287, 294, 250)", "coverage_pct": "67.9 (mean of 3 runs: 61.3, 70.7, 71.7; within 2x band of 70.7)", "coverage_abs": "130/191 (mean: 117, 135, 137)", "judge_acc": null, "judge_comp": null, "judge_usab": null, "judge_clar": null, "judge_overall": null, "judge_hallucinations": null, "notes": "BROKEN EXAMPLES: 13.8% mean (3 runs: 11.8, 21.2, 8.5) vs E13's 6.2%. The increase is HONEST — E13's <REQUIRED> placeholder satisfied the checker's missing_required test, hiding the true broken rate. E13b's inferred values are valid and runnable (e.g. judge_provider='ollama' when provider='ollama'). 0 placeholders across all 3 runs (vs 19 in E13). Remaining findings are missing_required (genuinely missing params the LLM didn't include) and occasional invalid_kwarg/syntax_error — these are GENERATION problems for E14 to address, not surgical verify problems. Coverage Run 1 (61.3%) is an outlier; Runs 2-3 (70.7%, 71.7%) are at or above baseline. Decision: KEEP — eliminates metric-gaming, coverage within 2x band, hallucination unchanged, grounded slightly higher."}
{"id": "E18", "date": "2026-08-29", "hypothesis": "A deterministic prose-API-semantics checker can catch C-hallucination (doc asserts false facts about REAL symbols) that the S-hallucination checker (invented-symbol rate) structurally misses.", "changes": ["New harness script: harness/prose_api_semantics_check.py", "6 finding types: PROSE_PROPERTY_AS_METHOD, PROSE_METHOD_AS_PROPERTY, RETURN_TYPE_MISMATCH, ARG_TYPE_MISMATCH, CROSS_PAGE_CONFLICT, MISSING_INSTALL_EXTRA", "AST-based class index with @property detection and return annotations", "Function-heading tracking to associate param bullets with the correct function", "Three arg-type extraction patterns: colon-splitting, table cells, 'function requires' prose", "Install-extra check: pip-install-without-extra + feature keyword in headings/CLI context"], "result": {"E13_e2e_docs": {"total_claims": 143, "total_findings": 52, "by_type": {"PROSE_PROPERTY_AS_METHOD": 30, "RETURN_TYPE_MISMATCH": 16, "ARG_TYPE_MISMATCH": 4, "MISSING_INSTALL_EXTRA": 2}, "adversarial_errors_caught": "7/7", "errors_caught": ["1. compare_judges arg type (results-analysis:90, quickstart:148)", "2. summary() return value (cli-reference:128, key-ideas:83, results-analysis:15/48/58)", "3. passed()/failed() as lists (results-analysis:17, architecture:117-118)", "4. Systematic method-vs-property (30 findings across 5 pages)", "5. judges/judge_labels as methods (architecture:72,76, key-ideas:110, results-analysis:77)", "6. Missing [visualize] extra (cli-reference, quickstart)", "7. model-auditor methods table (6 properties mislabeled as methods)"], "bonus_findings": ["reframing_check(records) arg type: StoredRecord vs Sequence[StoredRecord]", "reframing_check(variants) arg type: PromptVariant vs Sequence[PromptVariant]"]}, "E13b_run1_docs": {"total_claims": 113, "total_findings": 38, "note": "Current best-known docs have fewer findings \u2014 checker discriminates"}}, "decision": "KEEP", "rationale": "Checker catches all 7 known adversarial errors (decision rule: 'flags all 7 \u2192 KEEP'). No obvious false positives. Generic (no SimpleAudit-specific code). Provides a C-hallucination metric complementary to the S-hallucination (invented-symbol) metric.", "next": "Use E18 as a C-hallucination metric in the evaluation pipeline. Feed findings back into generation (E19: grounding pass that corrects method/property confusion)."}
{"id": "E14", "date": "2026-08-29", "hypothesis": "Injecting exact AST-derived constructor signatures into the narrative prompt will reduce invalid_kwarg findings without diluting coverage.", "changes": "Added extract_constructor_signatures() to reference.py (AST walk of all public classes, renders __init__ params with annotations/defaults). Injected into generate_page() in narrative.py as enrichment block. Generic \u2014 no SimpleAudit-specific code.", "runs": 3, "results": {"E14_r1": {"coverage": 0.639, "broken_pct": 2.0, "invalid_kwarg": 0, "halluc_pct": 0.0, "prose_findings": 48}, "E14_r2": {"coverage": 0.66, "broken_pct": 5.7, "invalid_kwarg": 0, "halluc_pct": 0.0, "prose_findings": 47}, "E14_r3": {"coverage": 0.67, "broken_pct": 5.9, "invalid_kwarg": 0, "halluc_pct": 0.0, "prose_findings": 38}, "mean": {"coverage": 0.656, "broken_pct": 4.5, "invalid_kwarg": 0, "halluc_pct": 0.0, "prose_findings": 44.3}}, "baseline": {"id": "E13b", "coverage_mean": 0.679, "broken_pct_mean": 13.8, "invalid_kwarg": "0-2", "halluc_pct": 0.0}, "decision": "KEEP", "rationale": "invalid_kwarg = 0 in 3/3 runs (baseline had 2); coverage drop 2.3pp < 4.2pp threshold; broken% improved 13.8\u21924.5% mean; hallucination 0.0% unchanged; generic AST-walk, no SimpleAudit-specific code.", "next": "De-Goodhart coverage (require substantive mention, not substring) or E16 (tests-as-evidence)."}
{"id": "E15", "date": "2026-08-29", "hypothesis": "The substring-match coverage metric is Goodhartable; requiring substantive mention (heading, code block, or definition sentence) will produce a more honest coverage number.", "changes": "Wrote coverage_check_v2.py: substantive-mention criterion (heading/code-block/definition-pattern/bold-term), AST-derived inventory (classes, functions, methods via ast.walk; CLI items via multi-line-aware regex; env vars via os.environ regex). Removed hand-authored concepts list.", "runs": 4, "results": {"E13b_run1": {"old_coverage": 0.707, "new_coverage": 0.654}, "E14_r1": {"old_coverage": 0.639, "new_coverage": 0.564}, "E14_r2": {"old_coverage": 0.66, "new_coverage": 0.514}, "E14_r3": {"old_coverage": 0.67, "new_coverage": 0.559}, "E14_mean": {"old_coverage": 0.656, "new_coverage": 0.546}}, "decision": "KEEP", "rationale": "Old metric inflated by ~10pp. v2 is now the canonical coverage metric. No RepoQuill code change \u2014 evaluation infrastructure only.", "next": "E16 (tests-as-evidence) or E17 (E5 A/B test)."}
{"id": "E16", "date": "2026-08-29", "hypothesis": "Injecting test files as behavioral ground truth will reduce C-hallucination (prose findings) without significant coverage or broken% cost.", "changes": "Added get_tests_context() to reference.py (AST-scored top-4 test files by assertion count, ~6KB). Wired into narrative.py via include_tests config flag (default False).", "runs": 3, "results": {"E16_r1": {"coverage_v2": 0.536, "broken_pct": 19.6, "invalid_kwarg": 0, "halluc_pct": 0.0, "prose": 37}, "E16_r2": {"coverage_v2": 0.57, "broken_pct": 7.1, "invalid_kwarg": 0, "halluc_pct": 0.0, "prose": 20}, "E16_r3": {"coverage_v2": 0.48, "broken_pct": 15.0, "invalid_kwarg": 0, "halluc_pct": 0.0, "prose": 35}, "mean": {"coverage_v2": 0.529, "broken_pct": 13.9, "invalid_kwarg": 0, "halluc_pct": 0.0, "prose": 30.7}}, "baseline": {"id": "E14", "coverage_v2_mean": 0.546, "broken_pct_mean": 4.5, "invalid_kwarg": 0, "halluc_pct": 0.0, "prose_mean": 44.3}, "decision": "REVERT", "rationale": "Broken% regressed 4.5\u219213.9% mean (+9.4pp). Coverage dropped 1.7pp. Prose findings improved (44.3\u219230.7) but broken% regression dominates. Tests crowd out source context without net benefit at this context budget. include_tests left in codebase (default False) for future experiments with larger context budgets.", "next": "E17 (E5 A/B test) or E19 (grounding pass)."}
{"id": "E17-v1", "type": "ab_test", "hypothesis": "verify_passes=1 (E5) may be redundant given E14 constructor-signature injection; test if removing it degrades quality", "design": "On-arm = E14_r1-r3 (verify_passes: 1); Off-arm = E17_off_r1-r3 (verify_passes: 0, identical config otherwise). Decision: off wins if broken% <= on+4.2pp AND coverage >= on-4.2pp", "on_arm": {"runs": ["E14_r1","E14_r2","E14_r3"], "cov_mean": 54.6, "cov_runs": [56.4,51.4,55.9], "broken_mean": 4.5, "broken_runs": [2.0,5.7,5.9], "prose_mean": 44.3, "prose_runs": [48,47,38], "halluc_mean": 0.0, "invalid_kwarg_mean": 0}, "off_arm": {"runs": ["E17_off_r1","E17_off_r2","E17_off_r3"], "cov_mean": 53.6, "cov_runs": [50.8,57.5,52.5], "broken_mean": 11.7, "broken_runs": [16.3,14.3,4.4], "prose_mean": 57.7, "prose_runs": [49,70,54], "halluc_mean": 0.0008, "invalid_kwarg_runs": [0,1,0]}, "result": "KEEP E5 (SUPERSEDED)", "rationale": "SUPERSEDED by E17-v2 (fresh A/B test). This entry reused E14_r1-r3 as the on-arm, which were generated with verify_passes: 1 but had different config parameters than the off-arm. The fresh E17-v2 test (3 fresh runs per arm, identical config except verify_passes) found no primary metric favors E5-on. See E17-v2 entry for authoritative result.", "date": "2026-08-29", "superseded_by": "E17-v2"}
{"id": "RETRO3", "type": "retrospective", "date": "2026-08-29", "questions": ["Is E14 broken% improvement real?", "Is v2 coverage a better proxy?", "Is E16 REVERT correct?", "Biggest blind spots in E14 docs"], "findings": {"Q1": "REAL \u2014 E14 examples more complex (4.41 vs 3.79 kwargs/call)", "Q2": "PARTIALLY \u2014 v2 stricter but noisier, needs 3+ runs", "Q3": "DEFENSIBLE \u2014 broken% regression dominates prose improvement", "Q4": "2 HIGH-severity issues in E14: language=\"en\" (should be \"English\"), missing run() event-loop caveat. Both are C-hallucinations not caught by any current checker."}, "action_items": ["E19 should target semantic value errors, not just prose API semantics", "Consider new checker for semantic value validation", "RETRO3 completed directly (fork unavailable in this session)"]}
{"id": "E19", "date": "2026-08-29", "type": "grounding_pass", "hypothesis": "Feeding prose-checker findings back into generation via targeted LLM correction reduces C-hallucination without coverage cost", "design": "E14 config + grounding_pass (new module: repoquill/grounding.py). 3 runs, each reuses E14_r{1,2,3} guides, runs prose checker, applies grounding pass, re-checks. Control: E14_r1-r3 (no grounding).", "results": {"control": {"cov_mean": 54.6, "broken_mean": 4.5, "halluc_mean": 0.3, "prose_mean": 44.3}, "treatment": {"cov_mean": 54.6, "broken_mean": 5.2, "halluc_mean": 0.3, "prose_mean": 11.3, "prose_reduction_pct": 74.5}}, "decision": "KEEP", "rationale": "Prose findings dropped from 44.3 to 11.3 (74.5% reduction) with zero coverage loss (54.6% = 54.6%). Decision rule met: prose < 20 AND coverage >= 50.4%. Grounding pass is generic (works on any repo with prose-checker findings).", "limitations": ["Grounding pass only fixes checker-detected findings; does NOT fix unmeasured semantic errors (RETRO3: language='en', missing run() caveat)", "Broken% slightly higher (5.2% vs 4.5%) but within variance band", "Grounding pass adds ~5-10 min to generation pipeline (one LLM call per page with findings)"], "files_added": ["repoquill/grounding.py"]}
{"experiment": "E17", "date": "2026-08-29", "hypothesis": "E5 LLM verify pass is unnecessary given E13b deterministic fixes", "result": "REVERT", "detail": "A/B test verify_passes 1 vs 0, 3 runs each on E14 baseline. Coverage v2: on=50.8% mean (51.4/50.8/50.3), off=53.0% mean (50.8/57.5/50.8). Delta 2.2pp within 4.2pp variance band. Broken%: on=12.7% mean, off=11.7% mean (within 18.1pp band). Prose: on=40.0, off=53.7 (off worse but secondary metric). No primary metric favors E5-on. Revert E5 to save compute.", "coverage_v2_on": [51.4, 50.8, 50.3], "coverage_v2_off": [50.8, 57.5, 50.8], "broken_on": [10.2, 11.9, 16.0], "broken_off": [16.3, 14.3, 4.5], "invalid_kwarg_on": [0, 1, 0], "invalid_kwarg_off": [0, 1, 0], "prose_on": [42, 39, 39], "prose_off": [49, 70, 42], "halluc": "0.0% all 6 runs"}
{"id": "E20", "date": "2026-08-29", "hypothesis": "A semantic value checker that flags (a) string literal values in code blocks that are strict prefixes/abbreviations of the source parameter's default, and (b) method calls with known runtime caveats that are not mentioned in the page, will catch the 2 HIGH-severity C-hallucination errors identified by RETRO3 (language='en' vs 'English', missing event-loop RuntimeError caveat) without false positives.", "experiment": "Built eval/semantic_value_check.py with 2 checks: STRING_VALUE_MISMATCH (global param-name -> defaults map, prefix/abbreviation heuristic) and MISSING_CAVEAT (global method-name -> caveats map, key-phrase matching). Validated against E14 and E19 docs.", "results": {"E14": {"total_findings": 12, "string_value_mismatches": 3, "missing_caveats": 9}, "E19": {"total_findings": 12, "string_value_mismatches": 3, "missing_caveats": 9}, "known_errors_caught": 2, "false_positives": 0}, "decision": "KEEP", "decision_rationale": "Checker catches both known RETRO3 errors (3 language='en' mismatches + 9 missing event-loop caveats) with 0 false positives. Generic design (param-name-agnostic and method-name-agnostic) works for any repo. Confirms RETRO3 secondary check: grounding pass (E19) cannot fix these errors because they are outside the prose checker's finding types.", "limitations": ["Prefix/abbreviation heuristic may miss non-prefix value errors (e.g. language='French' when default is 'English')", "Caveat key-phrase list is fixed (event loop, RuntimeError, active event, thread, asyncio) — may miss other runtime condition patterns", "Only checks fenced code blocks for string values, not inline code"], "files_added": ["eval/semantic_value_check.py"]}
{"experiment": "E20", "date": "2026-08-29", "hypothesis": "Semantic value checker can catch C-hallucinations (string value mismatches, missing caveats) that other checkers miss", "result": "PARTIAL (SUPERSEDED)", "detail": "EARLY VERSION: 20/23 false positives (provider='ollama', label_a='opus-4-7', etc. are legitimate user choices). The prefix/abbreviation heuristic was too aggressive — flagged any string value that was a prefix of the source default, including legitimate user-chosen values. SUPERSEDED by re-validation on 2026-08-29: current version of the checker correctly distinguishes user-chosen values from wrong defaults. Re-validated on E19_r3 docs: 11 findings (2 STRING_VALUE_MISMATCH for language='en', 9 MISSING_CAVEAT for event-loop restriction), 0 false positives. The 2 language='en' mismatches are genuine (source default is 'English'); all 9 MISSING_CAVEAT findings are genuine (no page mentions the event-loop restriction).", "superseded_by": "E20 re-validation 2026-08-29", "revalidation": {"doc_set": "E19_r3", "total_findings": 11, "string_value_mismatches": 2, "missing_caveats": 9, "false_positives": 0, "false_positive_rate": "0/11 (0%)"}}
{"experiment": "E21", "date": "2026-08-29", "hypothesis": "Wiring semantic checker into grounding pass enables LLM correction of semantic value errors", "result": "COMPLETE", "detail": "grounding.py already consumed semantic_value_check findings alongside prose findings (wired in by RETRO3 subagents). _fix_page_grounding prompt includes instructions for STRING_VALUE_MISMATCH and MISSING_CAVEAT. No additional code change needed. E22 tests the combined grounding pass.", "code_change": "none (already in place)"}
{"id": "E19", "type": "ab_test", "hypothesis": "Feeding prose-checker findings back into generation via targeted LLM correction (grounding pass) will reduce prose API-semantics errors without degrading coverage or broken%", "design": "3 runs. Each run: generate docs (E14 baseline config), run 4 checkers (pre), run grounding pass (feed prose findings + AST context to LLM for targeted correction), run 4 checkers (post). Decision: KEEP if prose findings drop >= 2x band (44.3 -> <20) AND coverage >= 50.4% (54.6% - 4.2pp band)", "runs": [{"run": "E19_r1", "pre": {"cov": 56.4, "broken": 2.0, "invalid_kwarg": 0, "halluc": 0.0, "prose": 39}, "post": {"cov": 56.4, "broken": 2.0, "invalid_kwarg": 0, "halluc": 0.0, "prose": 1}}, {"run": "E19_r2", "pre": {"cov": 46.4, "broken": 21.1, "invalid_kwarg": 1, "halluc": 0.0, "prose": 50}, "post": {"cov": 46.4, "broken": 21.1, "invalid_kwarg": 1, "halluc": 0.0, "prose": 1}}, {"run": "E19_r3", "pre": {"cov": 45.3, "broken": 8.3, "invalid_kwarg": 1, "halluc": 0.0, "prose": 41}, "post": {"cov": 45.3, "broken": 8.3, "invalid_kwarg": 1, "halluc": 0.0, "prose": 2}}], "post_means": {"cov": 49.4, "broken": 10.5, "prose": 1.3}, "pre_means": {"cov": 49.4, "broken": 10.5, "prose": 43.3}, "result": "KEEP E19 (grounding pass)", "rationale": "Prose findings: 43.3 -> 1.3 mean (97% reduction, far exceeds 2x band threshold of <20). Coverage unchanged (49.4% both pre and post). Broken% unchanged (10.5% both pre and post). Hallucination 0.0% in all runs. Grounding pass is deterministic in its input (prose findings + AST) and uses LLM only for targeted correction. The 10.5% broken% mean is higher than E14's 4.5% — this is generation variance (r2 had 21.1% broken), not a grounding-pass regression (broken% identical pre and post in all 3 runs).", "date": "2026-08-29"}
{"id": "E21", "date": "2026-08-29", "hypothesis": "Feeding the semantic value checker (E20) into the grounding pass will let the LLM correction pass fix string-literal mismatches (language='en' -> 'English') and add missing behavioral caveats (event-loop RuntimeError), closing the detect->fix->verify loop.", "method": "Extended repoquill/grounding.py to run BOTH prose_api_semantics_check.py AND semantic_value_check.py, merge findings, pass type-specific fix instructions to the LLM, re-run both checkers. Tested in isolation on E14 guides (OOM constraint blocks full generation).", "results": {"semantic_findings_before": 12, "semantic_findings_after": 1, "semantic_reduction_pct": 91.7, "string_mismatches_fixed": "3/3 (language='en' -> 'English')", "caveats_added": "8/9 (1 remaining is a false negative: exp.run() is AuditExperiment, not ModelAuditor)", "prose_findings": 2, "coverage_v2_pct": 56.4, "coverage_baseline_pct": 54.6, "hallucination_rate_pct": 0.0, "pages_fixed": 10, "findings_before_total": 60, "findings_after_total": 3}, "decision": "KEEP", "reason": "Closes the E20 loop: checker detects -> grounding pass fixes -> re-checker verifies. 91.7% semantic finding reduction with zero coverage regression (56.4% vs 54.6% baseline, +1.8pp) and zero hallucination regression (0.0%).", "limitations": ["Tested in isolation on E14 guides, not a full generation (OOM constraint)", "1 remaining MISSING_CAVEAT is a false negative in the checker (exp.run() is AuditExperiment, not ModelAuditor)", "Grounding pass adds ~1 LLM call per page with findings; cost scales with finding count"], "files_modified": ["repoquill/grounding.py"]}
