{"id": "RETRO4", "date": "2026-08-29", "type": "retrospective", "summary": "5th experiment since RETRO3. Key findings: (1) E21 semantic reduction is real but tested in isolation (not full generation); (2) E21 coverage 56.4% is a single-run number at the top of the E14/E19 variance band, NOT a real improvement; (3) workflows category in coverage_check_v2.py is a Goodhart risk — admits generic English words as concepts, inflating denominator by ~14 false-positive concepts (~5pp coverage deflation); (4) no other Goodhart risks identified; (5) usability is the next blind spot — no metric measures whether docs are USEFUL to a new developer.", "actions": ["Fix workflows category in coverage_check_v2.py (de-Goodhart)", "Validate E21 on full generation when OOM resolved", "Do NOT claim E21 improved coverage (within variance band)", "Establish 3-run mean for E21 best-known state", "Consider usability metric (next blind spot)"], "decision": "METHODOLOGY (no code change, retrospective only)"}
{"id":"E22","date":"2026-08-29","hypothesis":"Grounding pass with prose+semantic checkers reduces semantic findings to near 0 and prose findings to <20 without coverage loss","design":"3 runs of E14 baseline (verify_passes:0, temp 0.7) + grounding pass (prose+semantic checkers)","runs":{"E22_r1":{"cov":52.0,"broken":0.0,"invalid_kwarg":0,"halluc":0.0,"prose_before":32,"prose_after":2,"sem_before":4,"sem_after":1},"E22_r2":{"cov":59.2,"broken":0.0,"invalid_kwarg":0,"halluc":0.0,"prose_before":36,"prose_after":27,"sem_before":8,"sem_after":8},"E22_r3":{"cov":45.8,"broken":0.0,"invalid_kwarg":0,"halluc":0.0,"prose_before":33,"prose_after":27,"sem_before":6,"sem_after":5}},"means":{"cov":52.3,"broken":0.0,"prose":18.7,"sem":4.7},"comparison":{"E19_cov":54.6,"E19_broken":5.2,"E19_prose":11.3,"cov_delta":-2.3,"cov_band":4.2,"broken_delta":-5.2,"broken_band":18.1},"decision_criteria":{"cov_within_band":true,"broken_within_band":true,"sem_lt_5":true,"prose_lt_20":true},"result":"REVERT","rationale":"Combined grounding pass (prose+semantic) is LESS effective than prose-only (E19). Coverage 52.3% (E19: 54.6%, -2.3pp). Prose 18.7 (E19: 11.3, +7.4 worse). Semantic 4.7 (new metric, not near 0). The combined pass dilutes the prose-only correction. Best-known state remains E19 (prose-only grounding) + E23 (de-Goodhart coverage)."}
{"id":"E23","date":"2026-08-29","hypothesis":"The workflows category in coverage_check_v2.py admits generic English words as 'concepts' (Goodhart risk per RETRO4). Requiring substantive mention and filtering generic words will raise coverage by ~5pp.","design":"De-Goodhart fix: add 18 generic English words to the stoplist in get_workflows(). No LLM, no generation — just a checker fix. Re-run on E22 docs (3 runs).","results":{"E22_r1":{"old_cov":52.0,"new_cov":53.1},"E22_r2":{"old_cov":59.2,"new_cov":62.0},"E22_r3":{"old_cov":45.8,"new_cov":48.0},"mean_old":52.3,"mean_new":54.4,"delta":2.1},"workflows_category":{"old":"20/40 documented (50%)","new":"22/40 documented (55%)","terms_removed":["across","actually","aggregates","around","attributes","backward","before","behaviour","block","blocks","cache","cached","calls","canonical","chart","compat","content","conversation"]},"other_categories_affected":false,"decision_criteria":{"cov_rise_gte_3pp":false,"no_other_category_affected":true},"result":"KEEP","rationale":"Coverage rose 2.1pp (below the conservative 3pp threshold), but the fix is valid: it removes 18 generic English words from the denominator, making the coverage metric more honest. The workflows category went from 50% to 55% documented. No other category affected. De-Goodhart fix per RETRO4."}
{"id": "E22", "date": "2026-08-29", "type": "EVALUATION", "hypothesis": "The workflows category in coverage_check_v2.py admits generic English words (across, actually, around, etc.) as domain concepts via the frequency filter, inflating the denominator and deflating coverage by ~5pp (RETRO4 Goodhart risk).", "intervention": "Added 24 false-positive generic English words to the generic stopword set in get_workflows() (eval/coverage_check_v2.py lines 202-210).", "results": {"coverage_change": "+1.7pp mean (1.1-2.2pp across 3 runs)", "workflows_change": "20/40 \u2192 22/40 (r1), 20/40 \u2192 24/40 (r2), 18/40 \u2192 21/40 (r3)", "other_categories": "Unaffected", "decision": "KEEP (de-Goodhart fix: removes false-positive concepts from denominator; coverage rise is below 3pp threshold but the fix is correct and removes Goodhart risk)"}, "decision": "KEEP", "rationale": "The fix correctly removes generic English words that were being admitted as domain concepts. The coverage rise is smaller than expected (~1.7pp vs ~5pp) because the 40-concept cap means other domain concepts are now included. This is a de-Goodhart fix, not a generation improvement."}
{"experiment": "E22", "date": "2026-08-29", "hypothesis": "Combining prose + semantic checkers in the grounding pass fixes all known C-hallucination errors (language=\"en\", missing event-loop caveat) without coverage loss", "result": "REVERT", "detail": "3 runs. Coverage 52.3% mean (E19: 54.6%, -2.3pp). Prose 18.7 mean (E19: 11.3, +7.4 worse). Semantic 6.0→4.7 (only 21% reduction). Broken 0.0% (improvement). Hallucination 0.0%. The grounding pass fixed prose findings on some pages but was inconsistent on semantic findings: r1 fixed 3/4, r2 fixed 0/8, r3 fixed 1/6. The STRING_VALUE_MISMATCH findings in LLM-generated signature blocks (language: str = \"en\") were not reliably fixed. The MISSING_CAVEAT findings were partially fixed (event-loop caveats added to some pages). The combined grounding pass is LESS effective than the prose-only grounding pass from E19. REVERT to E19 as best-known state.", "code_change": "none (grounding.py already had both checkers wired in)"}
{"id":"E15","date":"2026-08-29","hypothesis":"The 11 narrative slugs are hand-authored for SimpleAudit. A generic system should derive page structure from the repository itself (LLM-planned structure).","design":"3 runs with narrative_sections removed from config (LLM plans structure). Compared to E22/E19 baseline (hand-authored 11 slugs, 54.4% coverage mean after E23).","runs":{"E15_r1":{"pages":["custom-packs","installation","methodology","quick-start","safety-scoring","validation"],"cov":44.7,"broken":0.0,"halluc":0.0,"prose":1,"sem":2},"E15_r2":{"pages":["custom-packs","installation","methodology","quick-start","safety-scoring","validation"],"cov":34.6,"broken":0.0,"halluc":0.0,"prose":9,"sem":3},"E15_r3":{"pages":["custom-packs","installation","methodology","quick-start","safety-scoring","validation"],"cov":36.3,"broken":0.0,"halluc":0.0,"prose":8,"sem":5}},"means":{"cov":38.5,"broken":0.0,"halluc":0.0,"prose":6.0,"sem":3.3},"comparison":{"E19_cov":54.6,"E19_broken":5.2,"E19_prose":11.3,"cov_delta":-16.1,"cov_band":4.2},"decision_criteria":{"cov_within_band":false,"broken_within_band":true,"halluc_no_regression":true,"prose_within_tolerance":true,"sem_within_tolerance":true},"result":"REVERT","rationale":"LLM-planned structure produces 6 generic pages (installation, methodology, quick-start, safety-scoring, validation, custom-packs) vs. 11 specific hand-authored pages. Coverage 38.5% mean (34.6-44.7%) vs. E19 baseline 54.6% — 16.1pp drop, well outside 4.2pp band. Broken% 0.0%, hallucination 0.0%, prose 6.0 (vs. 11.3), semantic 3.3 — all improved or equal. Hand-authored structure provides real value by ensuring coverage of specific concepts the LLM's generic planning misses (model-auditor, available-scenarios, results-analysis, judges-evaluation, cli-reference, visualization-server)."}
{"id": "E23", "date": "2026-08-29", "type": "EVALUATION", "hypothesis": "The workflows category in coverage_check_v2.py admits generic English words (actually, around, cache, chart, configured, etc.) as domain concepts via the frequency filter, inflating the denominator and deflating coverage by ~5pp (RETRO4 Goodhart risk).", "intervention": "Removed 18 generic English words from the workflows inventory in coverage_check_v2.py (eval/coverage_check_v2.py).", "results": {"coverage_change": "+2.1pp (52.3% -> 54.4% on E22 docs)", "decision": "KEEP (de-Goodhart fix: removes false-positive concepts from denominator; no generation behavior change)"}, "decision": "KEEP", "rationale": "De-Goodhart fix. Removes metric inflation without changing generation. Applied to E19 docs: coverage should be ~56.7% (54.6% + 2.1pp adjustment)."}
{"id":"E24","date":"2026-08-29","hypothesis":"Grounding pass variance (E22 showed inconsistent correction: r1 prose 32→2, r2/r3 prose 36→27/33→27) is caused by temperature 0.1 being too high or too many findings per page diluting the LLM's attention. Lowering temperature to 0.0 and/or capping findings at 5 will produce more consistent correction.","design":"4 variants × 3 runs: A (temp 0.1, max 20 = E19 config), B (temp 0.0, max 20), C (temp 0.1, max 5), D (temp 0.0, max 5). All prose-only grounding (no semantic checker).","results":{"A":{"cov":52.5,"broken":9.1,"prose":2.3,"sem":10.3,"halluc":0.0},"B":{"cov":55.1,"broken":13.9,"prose":1.3,"sem":8.3,"halluc":0.0},"C":{"cov":52.9,"broken":9.1,"prose":21.7,"sem":7.7,"halluc":0.0},"D":{"cov":51.4,"broken":4.9,"prose":22.7,"sem":6.0,"halluc":0.0},"E19_baseline":{"cov":54.6,"broken":5.2,"prose":11.3,"halluc":0.3}},"decision":"REVERT","rationale":"No variant beats E19 on all metrics simultaneously. B (temp 0.0) has best prose (1.3) and coverage (55.1%) but broken 13.9% (E19: 5.2%). C/D (max 5) have terrible prose (21.7/22.7) — limiting findings makes the LLM fix fewer issues. A (same config as E19) has broken 9.1% vs E19's 5.2% — this is base-generation variance, not a grounding-pass effect. Key insight: dominant broken-example failure mode is syntax_error from API signature snippets (legitimate documentation pattern, not actually broken). This is a Goodharting concern: the metric counts signature snippets as 'broken' when they're not really broken. Code changes (grounding_temperature, grounding_max_findings, grounding_semantic config options) KEPT for future experiments."}
{"id":"E25","date":"2026-08-29","hypothesis":"Fixing the example checker to exclude API signature snippets (which are legitimate documentation, not executable code) will reduce the broken-examples rate without affecting generation quality.","changes":["eval/example_check.py: added _is_signature_block() to detect and skip API signature snippets (Name(...) or Name.Name(...) patterns with type annotations that fail to parse as valid Python)"],"runs":3,"results":{"E25_r1":{"coverage":0.486,"broken_pct":21.3,"prose_findings":5,"halluc_pct":0.0},"E25_r2":{"coverage":0.503,"broken_pct":6.0,"prose_findings":1,"halluc_pct":0.0},"E25_r3":{"coverage":0.547,"broken_pct":13.3,"prose_findings":25,"halluc_pct":0.0},"mean":{"coverage":0.512,"broken_pct":13.5,"prose_findings":10.3,"halluc_pct":0.0}},"baseline":{"id":"E19","coverage_mean":0.546,"broken_pct_mean":4.2,"prose_findings_mean":11.3,"halluc_pct":0.3},"decision":"REVERT","rationale":"Checker fix is correct (properly excludes signature snippets — no syntax_error findings in E25 runs), but E25's broken% (13.5% mean) is WORSE than E19 (4.2% mean) with the same fixed checker. The high broken% is a real quality issue: the LLM is generating genuinely broken examples (property_called_as_method, missing_required, invalid_kwarg). The checker fix doesn't improve generation quality — it only makes the metric more honest. Coverage also regressed (51.2% vs 54.6%).","next":"Investigate why E25 runs have more broken examples than E19. Possible causes: (1) grounding pass is introducing errors, (2) LLM variance, (3) config differences. Consider running E19 config without grounding pass to isolate the variable."}
{"id":"E26","date":"2026-08-29","hypothesis":"Running E19 config WITHOUT grounding pass will isolate whether the grounding pass introduces broken examples. If broken% drops significantly without grounding → grounding pass is the cause of E25's regression. If broken% is similar → LLM variance.","changes":[],"runs":3,"results":{"E26_r1":{"coverage":0.547,"broken_pct":15.9,"prose_findings":49,"halluc_pct":0.0},"E26_r2":{"coverage":0.525,"broken_pct":17.5,"prose_findings":29,"halluc_pct":0.0},"E26_r3":{"coverage":0.570,"broken_pct":12.3,"prose_findings":34,"halluc_pct":0.0},"mean":{"coverage":0.547,"broken_pct":15.2,"prose_findings":37.3,"halluc_pct":0.0}},"baseline":{"id":"E19","coverage_mean":0.546,"broken_pct_mean":4.2,"prose_findings_mean":11.3,"halluc_pct":0.3},"decision":"INFORMATIVE","rationale":"E26 (WITHOUT grounding) has broken% = 15.2% — WORSE than E25 (WITH grounding, 13.5%) and E19 (WITH grounding, 4.2%). The grounding pass is NOT the cause of the broken-example regression. The dominant error type is property_called_as_method (13/14 findings in r1) — the LLM consistently calls @property attributes as methods. Root cause: extract_api_surface() lists ALL FunctionDef items as 'methods' without checking for @property decorators, so the LLM sees score() in the API surface and correctly calls it as a method. E27 will fix this.","next":"E27: Mark @property attributes in API surface extraction + add prompt rule."}
{"id":"E27","date":"2026-08-29","hypothesis":"Marking @property attributes as PROPERTIES (not methods) in the API surface extraction, plus adding a prompt rule to use them as attributes, will eliminate the dominant property_called_as_method broken-example type.","changes":["repoquill/reference.py: extract_api_surface() now detects @property and @cached_property decorators, lists them separately as [PROPERTIES: name1, name2] instead of in the methods list","repoquill/narrative.py: Added rule 7 to strict prompt: PROPERTIES are attributes, NOT methods. Use them as obj.name, never as obj.name()"],"runs":3,"results":{"E27_r1":{"coverage":0.536,"broken_pct":2.4,"prop_as_method":0,"prose_findings":12,"halluc_pct":0.0},"E27_r2":{"coverage":0.620,"broken_pct":8.2,"prop_as_method":0,"prose_findings":15,"halluc_pct":0.0},"E27_r3":{"coverage":0.497,"broken_pct":0.0,"prop_as_method":0,"prose_findings":13,"halluc_pct":0.0},"mean":{"coverage":0.551,"broken_pct":3.5,"prop_as_method":0.0,"prose_findings":13.3,"halluc_pct":0.0}},"baseline":{"id":"E19","coverage_mean":0.546,"broken_pct_mean":4.2,"prose_findings_mean":11.3,"halluc_pct":0.3},"decision":"KEEP","rationale":"property_called_as_method = 0 in 3/3 runs (was the dominant error type in E25/E26). Broken% 3.5% (E19: 4.2%, E25: 13.5%, E26: 15.2%). Coverage 55.1% (E19: 54.6%, within 4.2pp band). Halluc 0.0% (E19: 0.3%). Remaining broken findings are syntax_error (5 total across 3 runs) from legitimate code blocks, not property calls. Generic fix — any Python package with @property benefits.","next":"E28: Investigate remaining syntax_error findings (5 across 3 runs) or move to usability metric."}
{"id": "E28", "date": "2026-08-29", "hypothesis": "The 5 remaining syntax_error findings across E27 runs are from code blocks with leading indentation (a formatting artifact), not genuine code errors. Stripping leading indentation from code blocks before syntax-checking will eliminate the spurious findings.", "changes": ["eval/example_check.py: extract_python_blocks() now applies textwrap.dedent() to each code block before returning it. This strips leading indentation that the LLM sometimes adds to the entire code block (including the fence), which causes a spurious \"unexpected indent\" syntax error at line 1."], "runs": 0, "results": {"E27_r1": {"broken_pct_before": 2.4, "broken_pct_after": 0.0, "syntax_error_before": 1, "syntax_error_after": 0}, "E27_r2": {"broken_pct_before": 8.2, "broken_pct_after": 2.0, "syntax_error_before": 3, "syntax_error_after": 0, "remaining_findings": "1 missing_required (genuine error)"}, "E27_r3": {"broken_pct_before": 0.0, "broken_pct_after": 0.0, "syntax_error_before": 0, "syntax_error_after": 0}, "mean": {"broken_pct_before": 3.5, "broken_pct_after": 0.7, "syntax_error_before": 5, "syntax_error_after": 0}}, "baseline": {"id": "E27", "coverage_mean": 0.551, "broken_pct_mean": 3.5, "prose_findings_mean": 13.3, "halluc_pct": 0.0}, "decision": "KEEP", "rationale": "De-Goodhart fix: the metric now measures code correctness, not markdown formatting. All 5 syntax_error findings were from indented code blocks (formatting artifact), not genuine code errors. The remaining 1 missing_required finding in E27_r2 is a genuine error (AuditExperiment() missing 'models' param). Broken% drops from 3.5% to 0.7% mean. No generation change \u2014 evaluation infrastructure only.", "next": "E29: Investigate the 1 remaining missing_required finding (AuditExperiment() missing 'models' param) or move to usability metric."}
{"id": "E29", "date": "2026-08-29", "hypothesis": "The 1 remaining missing_required finding in E27_r2 (AuditExperiment() missing 'models' param) is either a genuine generation error or a checker false positive.", "changes": [], "runs": 0, "results": {"analysis": "models is a required param (no default) in AuditExperiment.__init__. The LLM generated AuditExperiment() without it in 1/9 cases (E27_r2 cli-reference.md). In the other 8 AuditExperiment() calls across 3 runs, the LLM correctly includes models. This is a one-off generation error, not a systematic issue.", "error_rate": "1/9 = 11% on AuditExperiment() calls (within variance)"}, "baseline": {"id": "E27+E28", "coverage_mean": 0.551, "broken_pct_mean": 0.7, "prose_findings_mean": 13.3, "halluc_pct": 0.0}, "decision": "NO_ACTION", "rationale": "The E14 constructor signature enrichment is working correctly (8/9 calls include required params). The 1 missing_required finding is within variance. No prompt change or checker refinement warranted for a single one-off error.", "next": "Research retrospective due (8 experiments since RETRO4). Launch fresh RETRO5."}
{"id":"E30","date":"2026-08-29","hypothesis":"The 13.3 mean prose findings in E27 runs are inflated by checker false positives. Fixing 3 FP sources (vague-return gate, member dedup, required-args guard) will reduce findings to ~5 true positives without affecting generation quality.","changes":["eval/prose_api_semantics_check.py: (1) vague-return gate now only fires on explicit -> None annotation, (2) member dedup eliminates duplicate (member_name, class_name) pairs with identical signatures, (3) required-args guard prevents flagging methods with required args as called-as-property"],"runs":0,"results":{"E27_r1":{"findings_before":12,"findings_after":5},"E27_r2":{"findings_before":15,"findings_after":6},"E27_r3":{"findings_before":13,"findings_after":4},"mean":{"findings_before":13.3,"findings_after":5.0,"fps_eliminated":12,"tps_kept":5},"tps_remaining":"4x summary() return claim + 1x MISSING_INSTALL_EXTRA"},"baseline":{"id":"E27","prose_findings_mean":13.3},"decision":"KEEP","rationale":"12 FPs eliminated, 5 TPs kept. The 5 remaining findings are genuine: 4x summary() claims to return a dict but has no return annotation (ambiguous), 1x MISSING_INSTALL_EXTRA (pydantic not in install extras). Generic fix — any Python package benefits from reduced FP noise.","next":"E31: Fix top-level import blind spot in hallucination checker."}
{"id":"E31","date":"2026-08-29","hypothesis":"The hallucination checker has a blind spot for top-level imports (from simpleaudit import X and import simpleaudit.Y) because idx.modules stores module names WITHOUT the package prefix. Fixing this will reveal previously invisible hallucinations.","changes":["eval/hallucination_check.py: (1) removed 'simpleaudit' from _KNOWN_NON_PROJECT, (2) _is_project_module() now accepts pkg_name and strips package prefix, (3) module resolution strips package prefix before looking up idx.module_symbols, (4) submodule handling checks if name is a known module before flagging"],"runs":0,"results":{"E27_r1":{"halluc_before":0.0,"halluc_after":0.7,"tps_revealed":["duplicate_scenario_names not exported from root"]},"E27_r2":{"halluc_before":0.0,"halluc_after":0.7,"tps_revealed":["duplicate_scenario_names not exported from root"]},"E27_r3":{"halluc_before":0.0,"halluc_after":0.0,"tps_revealed":[]},"mean":{"halluc_before":0.0,"halluc_after":0.7,"tps_total":3},"tps_details":["duplicate_scenario_names not exported from root (x2 runs)","simpleaudit.visualization doesn't exist (1 run)"]},"baseline":{"id":"E27","halluc_pct":0.0},"decision":"KEEP","rationale":"3 TPs revealed: duplicate_scenario_names is not exported from the package root (LLM hallucinated the import), simpleaudit.visualization doesn't exist (LLM hallucinated the module). The 0.0% rate was a blind spot, not genuine perfection. Generic fix — any Python package with submodules benefits.","next":"E32: Build claim-verification checker for C-hallucination metric."}
